{"cases":[{"artifact_replay":"blocked","blinded_rerun":"regression_only","case_id":"vercel-skills-symlink","contamination_class":"decision_informing","decision5_informed":true,"domain":"web","lesson_presence":"present","limitations":["Historical material informed Decision 0005 and is not an unbiased efficacy holdout.","No target or artifact execution is authorized by this matrix."],"reconstruction":"needs_review","scope_freshness":"stale","target_identity":"unknown","withheld_materials":["findings","reports","progress","pocs","case_memory","judge_packet"],"zone2_may_be_required":true},{"artifact_replay":"blocked","blinded_rerun":"regression_only","case_id":"netflix-zuul-stopfilterprocessing","contamination_class":"decision_informing","decision5_informed":true,"domain":"api","lesson_presence":"present","limitations":["Historical material informed Decision 0005 and is not an unbiased efficacy holdout.","No target or artifact execution is authorized by this matrix."],"reconstruction":"needs_review","scope_freshness":"missing","target_identity":"unknown","withheld_materials":["findings","reports","progress","pocs","case_memory","judge_packet"],"zone2_may_be_required":false},{"artifact_replay":"blocked","blinded_rerun":"regression_only","case_id":"cosmos-iavl-negative-version","contamination_class":"decision_informing","decision5_informed":true,"domain":"distributed-systems","lesson_presence":"present","limitations":["Historical material informed Decision 0005 and is not an unbiased efficacy holdout.","No target or artifact execution is authorized by this matrix."],"reconstruction":"needs_review","scope_freshness":"stale","target_identity":"unknown","withheld_materials":["findings","reports","progress","pocs","case_memory","judge_packet"],"zone2_may_be_required":true},{"artifact_replay":"blocked","blinded_rerun":"regression_only","case_id":"matomo-coreupdater","contamination_class":"decision_informing","decision5_informed":true,"domain":"web","lesson_presence":"present","limitations":["Historical material informed Decision 0005 and is not an unbiased efficacy holdout.","No target or artifact execution is authorized by this matrix."],"reconstruction":"needs_review","scope_freshness":"stale","target_identity":"unknown","withheld_materials":["findings","reports","progress","pocs","case_memory","judge_packet"],"zone2_may_be_required":true},{"artifact_replay":"blocked","blinded_rerun":"regression_only","case_id":"cosmos-cometbft-leads","contamination_class":"decision_informing","decision5_informed":true,"domain":"distributed-systems","lesson_presence":"present","limitations":["Historical material informed Decision 0005 and is not an unbiased efficacy holdout.","No target or artifact execution is authorized by this matrix."],"reconstruction":"needs_review","scope_freshness":"stale","target_identity":"unknown","withheld_materials":["findings","reports","progress","pocs","case_memory","judge_packet"],"zone2_may_be_required":false},{"artifact_replay":"blocked","blinded_rerun":"regression_only","case_id":"vercel-flags-prototype-pollution","contamination_class":"decision_informing","decision5_informed":true,"domain":"web","lesson_presence":"present","limitations":["Historical material informed Decision 0005 and is not an unbiased efficacy holdout.","No target or artifact execution is authorized by this matrix."],"reconstruction":"needs_review","scope_freshness":"missing","target_identity":"unknown","withheld_materials":["findings","reports","progress","pocs","case_memory","judge_packet"],"zone2_may_be_required":false},{"artifact_replay":"blocked","blinded_rerun":"regression_only","case_id":"vercel-workflow-token","contamination_class":"decision_informing","decision5_informed":true,"domain":"web","lesson_presence":"present","limitations":["Historical material informed Decision 0005 and is not an unbiased efficacy holdout.","No target or artifact execution is authorized by this matrix."],"reconstruction":"needs_review","scope_freshness":"missing","target_identity":"unknown","withheld_materials":["findings","reports","progress","pocs","case_memory","judge_packet"],"zone2_may_be_required":false},{"artifact_replay":"not_applicable","blinded_rerun":"regression_only","case_id":"alsco-royal","contamination_class":"decision_informing","decision5_informed":true,"domain":"web","lesson_presence":"present","limitations":["Historical material informed Decision 0005 and is not an unbiased efficacy holdout.","No target or artifact execution is authorized by this matrix."],"reconstruction":"needs_review","scope_freshness":"stale","target_identity":"unknown","withheld_materials":["findings","reports","progress","pocs","case_memory","judge_packet"],"zone2_may_be_required":true},{"artifact_replay":"not_applicable","blinded_rerun":"regression_only","case_id":"duplogreenengine-rpc-sweep","contamination_class":"decision_informing","decision5_informed":true,"domain":"api","lesson_presence":"present","limitations":["Historical material informed Decision 0005 and is not an unbiased efficacy holdout.","No target or artifact execution is authorized by this matrix."],"reconstruction":"needs_review","scope_freshness":"stale","target_identity":"unknown","withheld_materials":["findings","reports","progress","pocs","case_memory","judge_packet"],"zone2_may_be_required":false},{"artifact_replay":"blocked","blinded_rerun":"regression_only","case_id":"netflix-atlas-spectator-vercel-ms","contamination_class":"decision_informing","decision5_informed":true,"domain":"source-review","lesson_presence":"present","limitations":["Historical material informed Decision 0005 and is not an unbiased efficacy holdout.","No target or artifact execution is authorized by this matrix."],"reconstruction":"needs_review","scope_freshness":"missing","target_identity":"unknown","withheld_materials":["findings","reports","progress","pocs","case_memory","judge_packet"],"zone2_may_be_required":false},{"artifact_replay":"blocked","blinded_rerun":"regression_only","case_id":"cybench-xbow-subsets","contamination_class":"decision_informing","decision5_informed":true,"domain":"benchmark","lesson_presence":"present","limitations":["Historical material informed Decision 0005 and is not an unbiased efficacy holdout.","No target or artifact execution is authorized by this matrix."],"reconstruction":"needs_review","scope_freshness":"missing","target_identity":"unknown","withheld_materials":["findings","reports","progress","pocs","case_memory","judge_packet"],"zone2_may_be_required":false},{"artifact_replay":"blocked","blinded_rerun":"regression_only","case_id":"false-discovery-known-clean","contamination_class":"known_clean","decision5_informed":true,"domain":"hermetic","lesson_presence":"present","limitations":["Historical material informed Decision 0005 and is not an unbiased efficacy holdout.","No target or artifact execution is authorized by this matrix."],"reconstruction":"needs_review","scope_freshness":"missing","target_identity":"unknown","withheld_materials":["findings","reports","progress","pocs","case_memory","judge_packet"],"zone2_may_be_required":false}],"matrix_id":"decision5-historical-regression-v1","policy":{"artifact_execution":false,"historical_answers_exposed_to_runner":false,"target_contact":false,"zone2_creation":false},"schema_version":1}
